<?xml version="1.0" encoding="UTF-8" standalone="no"?>
<?xml-stylesheet type="text/xsl" href="bookstore.xsl"?>
<zahtev xmlns="http://www.ftn.uns.ac.rs/xwt"
    xmlns:xsi="http://www.w3.org/2001/XMLSchema-instance"
    xsi:schemaLocation="http://www.ftn.uns.ac.rs/xwt file:/C:/Users/Joco/Desktop/IV/XML/Projekat/XWT_2022/xml-backend-p1/data/P-1.xsd">
    <prijava>
        <broj_prijave>1</broj_prijave>
        <datum_prijema>2022-11-25</datum_prijema>
        <priznati_datum_podnosenja>2022-11-26</priznati_datum_podnosenja>
        <vrsta_prijave>dopunska</vrsta_prijave>
    </prijava>
    <zavod>
        <naziv>Zavod za intelektualnu svojinu</naziv>
        <adresa>
            <ulica>Kneginje Ljubice</ulica>
            <broj>5</broj>
            <postanski_broj>11000</postanski_broj>
            <mesto>Beograd</mesto>
            <drzava>Srbija</drzava>
        </adresa>
    </zavod>
    <pronalazak>
        <naziv_pronalaska_srb>Naziv na srpskom je srb</naziv_pronalaska_srb>
        <naziv_pronalaska_eng>Naziv na engleskom</naziv_pronalaska_eng>
    </pronalazak>

    <podnosilac pronalazac="false">
        <drzavljanstvo>srpsko</drzavljanstvo>
        <lice xsi:type="TPravnoLice">
            <adresa>
                <ulica>Vojvode Stepe</ulica>
                <broj>1</broj>
                <postanski_broj>21000</postanski_broj>
                <mesto>Novi Sad</mesto>
                <drzava>Srbija</drzava>
            </adresa>
            <kontakt>
                <telefon>021 824854</telefon>
                <email>aktiva@gmail.com</email>
            </kontakt>
            <poslovno_ime>Aktiva DOO</poslovno_ime>
        </lice>
    </podnosilac>
    <pronalazac naveden_u_prijavi="true">
        <lice xsi:type="TFizickoLice">
            <adresa>
                <ulica>Kralja Petra I</ulica>
                <broj>17</broj>
                <postanski_broj>21203</postanski_broj>
                <mesto>Veternik</mesto>
                <drzava>Srbija</drzava>
            </adresa>
            <kontakt>
                <telefon>0631899381</telefon>
                <email>jovancevicjovan5@gmail.com</email>
            </kontakt>
            <ime>Jovan</ime>
            <prezime>Jovancevic</prezime>
        </lice>
    </pronalazac>
    <punomoc>
        <tip>punomocnik_za_zastupanje</tip>
        <lice xsi:type="TFizickoLice">
            <adresa>
                <ulica>Omladinska</ulica>
                <broj>15</broj>
                <postanski_broj>21203</postanski_broj>
                <mesto>Veternik</mesto>
                <drzava>Srbija</drzava>
            </adresa>
            <kontakt>
                <telefon>062123789</telefon>
                <email>milanpanic@gmail.com</email>
            </kontakt>
            <ime>Milan</ime>
            <prezime>Panic</prezime>
        </lice>
    </punomoc>
    <ranije_prijave>
        <ranija_prijava>
            <broj_prijave>123</broj_prijave>
            <datum_podnosenja>2022-07-07</datum_podnosenja>
            <dvoslovna_oznaka>hl</dvoslovna_oznaka>
        </ranija_prijava>
        <ranija_prijava>
            <broj_prijave>123</broj_prijave>
            <datum_podnosenja>2022-07-07</datum_podnosenja>
            <dvoslovna_oznaka>hl</dvoslovna_oznaka>
        </ranija_prijava>
    </ranije_prijave>
    <nacin_dostavljanja>elektronska_forma</nacin_dostavljanja>
</zahtev>