<?xml version="1.0" encoding="UTF-8"?>
<zahtev xmlns:xsi="http://www.w3.org/2001/XMLSchema-instance"
    xsi:noNamespaceSchemaLocation="file:/C:/Users/Joco/Desktop/IV/XML/Projekat/XWT_2022/KT1/P-1.xsd">
    <prijava>
        <broj_prijave></broj_prijave>
        <datum_prijema></datum_prijema>
        <priznati_datum_podnosenja></priznati_datum_podnosenja>
        <vrsta_prijave></vrsta_prijave>
    </prijava>
    <zavod>
        <naziv></naziv>
        <adresa>
            <ulica></ulica>
            <broj></broj>
            <postanski_broj></postanski_broj>
            <mesto></mesto>
            <drzava></drzava>
        </adresa>
    </zavod>
    <pronalazak>
        <naziv_pronalaska_srb></naziv_pronalaska_srb>
        <naziv_pronalaska_eng></naziv_pronalaska_eng>
    </pronalazak>
    <podnosilac>
        <adresa>
            <ulica></ulica>
            <broj></broj>
            <postanski_broj></postanski_broj>
            <mesto></mesto>
            <drzava></drzava>
        </adresa>
        <kontakt>
            <telefon></telefon>
            <email></email>
        </kontakt>
        <drzavljanstvo></drzavljanstvo>
    </podnosilac>
    <pronalazac>
        <adresa>
            <ulica></ulica>
            <broj></broj>
            <postanski_broj></postanski_broj>
            <mesto></mesto>
            <drzava></drzava>
        </adresa>
        <kontakt>
            <telefon></telefon>
            <email></email>
        </kontakt>
    </pronalazac>
    <punomoc>
        <tip></tip>
        <adresa>
            <ulica></ulica>
            <broj></broj>
            <postanski_broj></postanski_broj>
            <mesto></mesto>
            <drzava></drzava>
        </adresa>
        <kontakt>
            <telefon></telefon>
            <email></email>
        </kontakt>
    </punomoc>
    <ranije_prijave></ranije_prijave>
    <nacin_dostavljanja></nacin_dostavljanja>
</zahtev>